id,author,date,network,source,state,text,title,url,x,y
georgia-peachtreetimes-662158845,Peach Tree Times,2024-07-29,Metric Media Network,Peach Tree Times,Georgia,"Georgia's Attorney General Chris Carr stated that it is ""illegal for non-citizens to vote"" in Georgia, with violators facing ""prosecution."" He urged the U.S. Senate to pass the ""SAVE Act"" to enforce similar measures nationwide. Carr made his statement in a July 17 post on X.""In Georgia, it's illegal for non-citizens to vote, and those who violate the law are subject to prosecution,"" said General Chris Carr. ""My colleagues and I are urging the U.S. Senate to pass the SAVE Act and implement this commonsense approach across the country.""The SAVE Act bill mandates that individuals must provide documentary proof of U.S. citizenship to register for federal elections. It prohibits states from processing voter registration applications without such proof. States must also take proactive measures to ensure that only U.S. citizens are registered and remove noncitizens from voter lists. Additionally, the bill allows for private legal action against election officials who fail to enforce these requirements and establishes criminal penalties. According to Congress.gov, the Election Assistance Commission must issue implementation guidance within 10 days.In Georgia, voter citizenship is verified through Real ID documentation already on file with the state. If these documents are insufficient, additional verification is conducted using the federal Systematic Alien Verification for Entitlements database. According to the Georgia Secretary of State, voters who cannot prove their citizenship through these methods must provide proof to election officials.Carr was appointed as Georgia's attorney general by then-Governor Nathan Deal in 2016 and was re-elected in November 2022. Since taking office, he has focused on addressing issues such as human trafficking, gang activity, and opioid misuse, including the establishment of the state's first Human Trafficking Prosecution Unit and Gang Prosecution Unit. Additionally, Carr previously served as commissioner of the Georgia Department of Economic Development, during which Georgia was recognized as the top state for business, with substantial investment and job creation.",Georgia State AG Chris Carr: 'The SAVE Act' would ensure 'it’s illegal for non-citizens to vote',https://peachtreetimes.com/stories/662158845-georgia-state-ag-chris-carr-the-save-act-would-ensure-it-s-illegal-for-non-citizens-to-vote,8.114594,-0.43801066
georgia-peachtreetimes-664261300,Peach Tree Times,2024-09-11,Metric Media Network,Peach Tree Times,Georgia,"The House Rural Development Council, co-chaired by State Representatives Gerald Greene (R–Cuthbert) and Mack Jackson (D-Sandersville), will hold its next meeting on Thursday, September 19, 2024, from 9 a.m. to 3:30 p.m. at the Thomson Depot in Thomson, Georgia.An agenda and a live stream for this meeting may be found here.",House Rural Development Council schedules next meeting in Thomson,https://peachtreetimes.com/stories/664261300-house-rural-development-council-schedules-next-meeting-in-thomson,-4.5819025,5.106285
georgia-peachtreetimes-664232843,Peach Tree Times,2024-09-09,Metric Media Network,Peach Tree Times,Georgia,"The State of Georgia’s net tax collections for August amounted to nearly $2.34 billion, marking an increase of $54.3 million or 2.4 percent compared to August 2023 (FY 2024), when net tax collections were $2.28 billion. Year-to-date, net tax revenue collections totaled $4.90 billion, reflecting an increase of $120.6 million or 2.5 percent compared to FY 2024, which saw net tax collections of $4.78 billion after two months.The changes within the following tax categories account for August’s overall net tax revenue increase:Individual Income Tax: Individual Income Tax collections for the month totaled nearly $1.14 billion, a decrease of $114.5 million or 9.1 percent from $1.25 billion in August of FY 2024.Notable components within Individual Income Tax contributing to the net decrease include:- Individual Income Tax refunds issued (net of voided checks) decreased by $15 million or 17.3 percent.- Income Tax Withholding payments in August decreased by $125 million or 10.1 percent from FY 2024.- Individual Income Tax Estimated payments decreased by $2.5 million or 11.5 percent compared to FY 2024.- All other Individual Tax categories, including Return Tax payments, were down a combined $2 million.Sales and Use Tax: Gross Sales and Use Tax collections for August totaled nearly $1.58 billion, an increase of $57.7 million or 3.8 percent over FY 2024. Net Sales and Use Tax increased by $97.2 million or 14.7 percent compared to August 2023, when net Sales Tax revenue was $662.4 million. The adjusted Sales Tax distribution to local governments totaled $811.8 million, a decrease of roughly $4 million or 0.5 percent from the previous fiscal year, while Sales Tax refunds declined by $35.6 million compared to FY 2024.Corporate Income Tax: Corporate Income Tax collections for August amounted to $44.3 million, an increase of $46.1 million compared to last year when refunds outstripped tax revenue collections by $1.85 million.Notable components within Corporate Income Tax contributing to the net increase include:- Corporate Income Tax refunds issued (net of voids) were down by $30.3 million or 52.7 percent from FY 2024.- Corporate Income Tax Estimated payments increased by $7.2 million or 31.2 percent from August 2023.- All other Corporate Tax payments, including Corporate Return payments, were up a combined $8.6 million.Motor Fuel Taxes: Motor Fuel Tax collections for August were reported at $193.2 million, an increase of $10.9 million or 6 percent compared to FY 2024 when motor fuel excise taxes totaled $182.3 million for the month.Motor Vehicle - Tag & Title Fees: Motor Vehicle Tag & Title Fee collections for August decreased by nearly $7.5 million or 17% while Title ad Valorem Tax (TAVT) collections increased by approximately $12 .8 million or 20 .8% over the previous fiscal year.",Georgia's net tax revenues rise by over two percent in August,https://peachtreetimes.com/stories/664232843-georgia-s-net-tax-revenues-rise-by-over-two-percent-in-august,5.3489113,8.746807
georgia-peachtreetimes-661192193,Peach Tree Times,2024-07-03,Metric Media Network,Peach Tree Times,Georgia,"In the first quarter of 2024, two Tobacco companies received two FDA inspections in Georgia, according to the U.S. Food and Drug Administration (FDA). This was the second lowest number of inspections per type of company made by the FDA in Georgia, equalling 5.6% of all inspections in the first quarter of 2024. The FDA routinely inspects facilities across the nation to determine if the workplaces and their products are compliant with FDA-regulated laws and regulations implemented to improve overall public health. Inspection results are then disclosed publicly for businesses to consistently make smarter business decisions for the future.The FDA is a government agency primarily responsible for monitoring the manufacturing and distribution of human and animal drugs, biological products, medical supplies and tobacco products for safety quality, according to its website.FDA Inspections in Georgia During Q1Project AreaNo Action IndicatedVoluntary Action IndicatedOfficial Action IndicatedBioresearch Monitoring1----Blood and Blood Products31--Compliance: Devices2----Drug Quality Assurance--1--Food Composition, Standards, Labeling and Econ3----Foodborne Biological Hazards204--Human Cellular, Tissue, and Gene Therapies2----Technical Assistance: Food and Cosmetics--1--Tobacco Post-Market Activities2----",FDA conducted second lowest number of inspections on Tobacco companies in Georgia during Q1,https://peachtreetimes.com/stories/661192193-fda-conducted-second-lowest-number-of-inspections-on-tobacco-companies-in-georgia-during-q1,5.69233,13.549932
georgia-peachtreetimes-662493218,Peach Tree Times,2024-08-12,Metric Media Network,Peach Tree Times,Georgia,"Lori Roman, CEO of the American Constitutional Rights Union, stated that Second Amendment rights are women’s rights, and that firearms are “the only equalizer” for women in self-defense situations. ""Gun rights are women's rights,"" Roman said. ""Firearms are the only equalizer for women who wish to defend themselves from harm."" Roman’s comments come amid reports of Vice President Kamala Harris’ history including her support for Australia’s national firearms laws, which don’t consider self-defense as a legitimate reason for gun ownership, and her past support for Washington DC’s self-defense handgun ban, which was subsequently declared unconstitutional. According to a report from the Peach Tree Times, there are currently an estimated 350,000 gun owners in Georgia that aren't registered to vote in the upcoming Presidential election between Vice President Harris and Former President Trump. The report noted that gun owners are more likely to be Republicans, and could be a key voting bloc in the upcoming election.According to a recent report from the Center Square, Vice President Harris has a history of supporting restrictions on firearms and the second amendment. As San Francisco District Attorney, Harris led a group of prosecutors in urging the Supreme Court to uphold Washington DC's total handgun ban, which was found unconstitutional. Harris, as Vice President, spoke favorably of Australia's gun restrictions which do not consider self-defense as a ""genuine reason"" for gun ownership. Recent studies have shown an increase in women purchasing and owning guns. According to data from Harvard University, between 2019 and 2021 about half of all gun purchases were made by women and new gun owners were more likely to be female during that period. Data from Gallup, reported by Fox News, found that the percentage of women reporting that they owned a gun rose from 15% to 22% between 2016 and 2022.There are currently 7,135,681 active registered voters in Georgia. In 2020 the presidential election in Georgia was decided by 11,779 votes, according to the GA Secretary of State. Georgians wanting to register can do so now through October 7th online or by mail through the Georgia Secretary of State’s office. Lori Roman is the CEO of the American Constitutional Rights Union. Roman served in the administration of President George W. Bush. The ACRU was founded in 1999 to protect Americans’ Constitutional rights.",American Constitutional Rights Union CEO: 'Firearms are the only equalizer for women who wish to defend themselves from harm',https://peachtreetimes.com/stories/662493218-american-constitutional-rights-union-ceo-firearms-are-the-only-equalizer-for-women-who-wish-to-defend-themselves-from-harm,10.736163,1.159622
georgia-peachtreetimes-664567393,Peach Tree Times,2024-09-26,Metric Media Network,Peach Tree Times,Georgia,"The House Study Committee on Safety & Consumer Protection in the Tree Care Industry will hold its next meeting on Wednesday, October 2, 2024. The session is scheduled from 10 a.m. to 12 p.m. at Peachtree Corners City Hall.State Representative Victor Anderson (R-Cornelia) chairs the committee. Other members include State Representatives Marvin Lim (D-Norcross), David Huddleston (R-Roopville), Jordan Ridley (R-Woodstock), and Bill Yearta (R-Sylvester).The meeting can be viewed via live stream for those unable to attend in person.""WHO: Members of the House Study Committee on Safety & Consumer Protection in the Tree Care Industry""""WHAT: Study Committee Meeting""""WHEN: Wednesday, October 2, 2024, from 10 a.m. – 12 p.m.""""WHERE: Peachtree Corners City Hall, 310 Technology Pkwy, Peachtree Corners, GA 30092""",House study committee to meet on tree care industry safety,https://peachtreetimes.com/stories/664567393-house-study-committee-to-meet-on-tree-care-industry-safety,-0.9359767,1.6380634
georgia-peachtreetimes-662725714,Peach Tree Times,2024-08-14,Metric Media Network,Peach Tree Times,Georgia,"The House Rural Development Council, co-chaired by State Representatives Gerald Greene (R–Cuthbert) and Mack Jackson (D-Sandersville), will convene its first meeting of 2024 on Thursday, August 29, from 9 a.m. to 3:30 p.m. The session will take place at the Oak Hill and Martha Berry Museum in Rome.Established in 2017, the House Rural Development Council aims to collaborate with rural communities to foster economic growth and job creation. The council was renewed for the current term during the 2023 legislative session through the unanimous adoption of House Resolution 488.An agenda and live stream for this meeting are available online.",House Rural Development Council to hold first meeting of 2024 in Rome,https://peachtreetimes.com/stories/662725714-house-rural-development-council-to-hold-first-meeting-of-2024-in-rome,-4.6025195,5.015378
georgia-peachtreetimes-664088511,Peach Tree Times,2024-09-06,Metric Media Network,Peach Tree Times,Georgia,"The House Study Committee on Navigable Streams and Related Matters, chaired by State Representative Lynn Smith (R-Newnan), is scheduled to hold its next meeting on Friday, September 20, 2024. The session will commence at 9 a.m. at the Unicoi State Park & Lodge in Helen, Georgia.For those interested in following the proceedings remotely, a livestream of the meeting will be available.The committee comprises members who focus on issues related to navigable streams and associated concerns within the state.Details for the upcoming meeting are as follows:- **Who:** Members of the House Study Committee on Navigable Streams and Related Matters- **What:** House Study Committee Meeting- **When:** Friday, September 20, 2024, at 9 a.m.- **Where:** Unicoi State Park & Lodge, 1788 GA-356, Helen, GA 30545###",House committee to meet in Helen on navigable streams,https://peachtreetimes.com/stories/664088511-house-committee-to-meet-in-helen-on-navigable-streams,0.017769465,2.0797951
georgia-peachtreetimes-663895956,Peach Tree Times,2024-08-29,Metric Media Network,Peach Tree Times,Georgia,"Governor Brian P. Kemp announced today that the Georgia Forestry Commission (GFC) Board has unanimously appointed Johnny Sabo as the new Director and State Forester of GFC, effective September 1. The GFC Board entered executive session on August 27 to evaluate and vote on the new Executive Secretary, Administrative Officer, and Director/State Forester following the resignation of Tim Lowrimore, effective September 15.""I know Johnny will continue the good work of the GFC, ensuring the success of our forestry industry,"" said Governor Brian Kemp. ""As the No. 1 forestry state in the nation, Georgia and its forests depend on GFC for a multitude of services. Under Johnny's leadership, I am confident that mission will be fulfilled successfully.""Johnny Sabo joined the Georgia Forestry Commission as Deputy Director in April 2023. Prior to joining GFC, he served nearly 20 years with the Florida Forest Service. At GFC, Sabo has direct oversight of the Forest Management, Forest Protection, and Law Enforcement departments, as well as five regions spanning the entire state where field operations are conducted. He also serves on the Georgia Forestry Foundation Board of Trustees and the Georgia Sentinel Landscape Executive Committee. Sabo holds a bachelor’s degree in Forest Resource Management from Clemson University. He resides in Macon with his wife Christina and their son.",Gov. Kemp announces new director for Georgia Forestry Commission,https://peachtreetimes.com/stories/663895956-gov-kemp-announces-new-director-for-georgia-forestry-commission,2.5725834,0.9857578
georgia-peachtreetimes-661892827,Peach Tree Times,2024-07-14,Metric Media Network,Peach Tree Times,Georgia,"In the second quarter of 2024, two Drugs companies received two FDA inspections in Georgia, according to the U.S. Food and Drug Administration (FDA). This was the lowest number of inspections per type of company made by the FDA in Georgia, equalling 7.4% of all inspections in the second quarter of 2024. The FDA routinely inspects facilities across the nation to determine if the workplaces and their products are compliant with FDA-regulated laws and regulations implemented to improve overall public health. Inspection results are then disclosed publicly for businesses to consistently make smarter business decisions for the future.The FDA is a government agency primarily responsible for monitoring the manufacturing and distribution of human and animal drugs, biological products, medical supplies and tobacco products for safety quality, according to its website.FDA Inspections in Georgia During Q2Project AreaNo Action IndicatedVoluntary Action IndicatedOfficial Action IndicatedBioresearch Monitoring4----Blood and Blood Products11--Compliance: Devices1----Food Composition, Standards, Labeling and Econ2----Foodborne Biological Hazards115--Human Cellular, Tissue, and Gene Therapies11--Monitoring of Marketed Animal Drugs, Feed, and Devices11--Postmarket Assurance: Devices1----Technical Assistance: Food and Cosmetics1----",Georgia: Drugs companies were the least FDA inspected companies in Georgia in Q2,https://peachtreetimes.com/stories/661892827-georgia-drugs-companies-were-the-least-fda-inspected-companies-in-georgia-in-q2,4.7774677,13.536299
georgia-peachtreetimes-665316766,Peach Tree Times,2024-10-21,Metric Media Network,Peach Tree Times,Georgia,"The Technology and Infrastructure Innovation Subcommittee on Artificial Intelligence, led by State Representative Brad Thomas, is set to convene its upcoming meeting on October 23, 2024. The session will take place at the University of Georgia Iron Horse Plant Sciences Farm in Watkinsville, Georgia.The subcommittee's meeting will occur alongside the Senate Study Committee on Artificial Intelligence. The event is scheduled to start at 10 a.m., with an option for interested parties to view the proceedings via livestream.The subcommittee focuses on exploring advancements and issues related to artificial intelligence within the realm of technology and infrastructure.",AI subcommittee schedules next meeting in Watkinsville,https://peachtreetimes.com/stories/665316766-ai-subcommittee-schedules-next-meeting-in-watkinsville,0.86269397,-0.16614841
georgia-peachtreetimes-662631905,Peach Tree Times,2024-08-13,Metric Media Network,Peach Tree Times,Georgia,"The House Study Committee on Disaster Mitigation and Resilience, chaired by State Representative Clint Crowe (R-Jackson), is scheduled to hold its inaugural meeting on Thursday, August 22, 2024. The session will commence at 10 a.m. at the Butts County Administrative Building in Jackson.Members of the public interested in observing the proceedings can access a live stream of the meeting.The committee's focus will be on disaster mitigation and resilience strategies, aiming to enhance preparedness and response measures within the state.""WHO: Members of the House Study Committee on Disaster Mitigation and Resilience""""WHAT: Study Committee Meeting""""WHEN: Thursday, August 22, 2024 - 10 a.m.""""WHERE: Butts County Administrative Building, 625 W 3rd Street, Jackson, GA 30233""",House committee on disaster mitigation to hold first meeting in Jackson,https://peachtreetimes.com/stories/662631905-house-committee-on-disaster-mitigation-to-hold-first-meeting-in-jackson,-0.17241377,1.2287397
georgia-peachtreetimes-664780219,Peach Tree Times reports,2024-10-04,Metric Media Network,Peach Tree Times,Georgia,"President Donald Trump said the Federal Emergency Management Agency (FEMA) under the Biden-Harris administration gave ""over a billion dollars to illegal migrants"" and did not reserve any money to provide relief efforts for states like Georgia after the destruction from Hurricane Helene. ""They are doing a very bad job,"" Trump said in response to a reporter's question about FEMA not having enough money to last through the hurricane season. ""They've given over a billion dollars to illegal migrants that came in and now they have no money for North Carolina, for Georgia, for South Carolina, and Alabama, Tennessee, and Florida.""""I think that's a disgrace,"" said Trump. ""This is a country that's being run by fools.""FEMA has designated approximately $364 million for the fiscal year 2023 and $650 million for fiscal year 2024 to the “Shelter and Services Program.”According to the Department of Homeland Security (DHS) the program is run along with the U.S. Customs and Border Protection (CBP) “to support CBP in the safe, orderly and humane release of noncitizen migrants from short-term holding facilities."" Under the current administration, FEMA’s top priorities do not list disaster relief as one of its two main goals. According to FEMA’s website, the primary objectives are to establish “equity as a foundation of emergency management” and to “lead the whole community in climate resilience.” The aim of “promoting and sustaining a ready FEMA and prepared nation” comes in third on the department's priority list. The death count from Hurricane Helene has reached a minimum of 224 individuals across six states in the southeast U.S., with 33 reported deaths across the state of Georgia. 2,000 members of the Georgia National Guard were deployed to aid in relief efforts. Roughly 260,000 homes in the state are still without power a week after the hurricane hit, with Governor Brian Kemp suspending the gas tax as a relief effort across the state, particularly the rural areas currently depending on generator power. The damages estimates are $417 million in Georgia. U.S. Homeland Security Secretary Alejandro Mayorkas cautioned that if another storm were to hit the US in the coming months, the Federal Emergency Management Agency would face challenges in delivering assistance. Hurricane season lasts through the end of November, with Hurricane Kirk and Tropical Storm Leslie currently being monitored. ",Trump: Biden-Harris Admin gave 'over a billion dollars to illegal migrants' and have no money for Georgia,https://peachtreetimes.com/stories/664780219-trump-biden-harris-admin-gave-over-a-billion-dollars-to-illegal-migrants-and-have-no-money-for-georgia,5.491722,3.2502508
georgia-peachtreetimes-664621005,Peach Tree Times,2024-09-30,Metric Media Network,Peach Tree Times,Georgia,"State Representative Gabe Okoye of Lawrenceville has issued a statement following the passing of James Scott Vandiver on September 26, 2024.“I extend heartfelt condolences to the family and friends of J. Scott Vandiver,” said Rep. Okoye. “Although I did not have the privilege of knowing Scott personally, I recognize his deep commitment to the people of Gwinnett County and his dedication to public service as the Republican candidate for Georgia State House District 102. I have no doubt his active involvement in the community will be remembered by many. My thoughts and deepest sympathies go out to his family and friends during this incredibly difficult time. Please keep the Vandiver family in your thoughts and prayers as they navigate this loss.”",Rep. Gabe Okoye comments on James Scott Vandiver's passing,https://peachtreetimes.com/stories/664621005-rep-gabe-okoye-comments-on-james-scott-vandiver-s-passing,-10.544318,1.1196046
