id,author,date,network,source,state,text,title,url,x,y
georgia-peachtreetimes-663997871,Nicholas Malfitano,2024-09-13,Metric Media Network,Peach Tree Times,Georgia,"A new lawsuit brought in a Georgia federal court alleges that Fulton County “does not maintain, nor does it even attempt to maintain, accurate voter rolls” and seeks to compel county and state authorities to abide by Georgia state law pertaining to elections and voter eligibility.“Fulton County does not maintain, nor does it even attempt to maintain, accurate voter rolls. Just months ago, during an on-record Fulton County Board of Commissioners hearing, questions were asked to the Chair of the Fulton County Department of Registration and Elections (FCDRE) concerning whether the FCDRE was fulfilling its lawfully compelled and non-discretionary duties regarding voter list maintenance,” read the lawsuit, filed in the U.S. District Court for the Northern District of Georgia on Aug. 28.“When asked whether ineligible voters were being removed from the voter roll, FCDRE’s Chair admitted that ‘Fulton County never conducts an independent search for anybody; dead people, felons, [or even] people who live out-of-state.”The lawsuit was brought by Jason Frazier and Earl Ferguson versus the FCDRE, its Members Sherri Allen, Aaron Johnson, Michael Heekin and Teresa K. Crawford, its Registration Manager Kathryn Glenn and Georgia Secretary of State Brad Raffensperger.It alleges that Fulton County has violated the National Voter Registration Act (NVRA), which mandates all states to “conduct a general program that makes a reasonable effort to remove the names of ineligible voters from the official lists of eligible voters.”Under Georgia state law pertaining to elections, plaintiff Frazier submitted a voter roll challenge on Aug. 4 to contest the continued inclusion of certain electors who are no longer eligible to vote in Fulton County—and was required to have received a response containing notice of a hearing within 10 business days of his challenge being received, but did not.“The issue here is that defendants, as a direct and proximate result of their communications with defendant Raffensperger, have conspicuously taken the NVRA’s aforesaid 90-day ‘quiet period’ and transposed the prohibition against removing ineligible voters identified by a state ran and operated systemic voter removal program and placed the prohibition upon any voters identified by a challenger’s use of a program that he or she uses in the [voter] challenge submission process,” the suit says.“Secretary Raffensperger has falsely advised and/or instructed that federal law prohibits county election officials in Fulton County and throughout Georgia’s remaining 158 other counties from removing voters within 90 days of a federal election, if the ineligible voters identified by a [voter] challenge were found to be ineligible based upon a challenger’s use of a program. But this is not what the NVRA says, and in the case of plaintiff Earl Ferguson, this is the precise basis upon which his [voter] challenge was rejected.”The suit seeks, in part, a writ of mandamus “declaring defendants have violated well-settled federal and state law; to enjoin defendants from further violating state and federal law, and to compel by way of mandamus relief each defendant named in this action to fulfill their express, non-discretionary duties as public elections officials in the State of Georgia.”Multiple requests for comment to plaintiffs' counsel went unanswered.Peach Tree Times has submitted a Freedom of Information Act (FOIA) request to the Secretary of State’s office for Fulton County voter rolls, including their list of potentially ineligible voters for the county to notify. A FOIA request was also submitted to the FCDRE asking for the same records along with the organization's status in notifying the voters on that same list.The climate in Georgia with respect to election integrity has been at a fever pitch since the 2020 Presidential Election and remains so in the lead-up to the November election. The Associated Press reported in June that conservative activists were advocating for the use of artificial intelligence-powered software to more quickly purge invalid registrations from voter rolls. Opponents of the concept say that voter protection and transparency associated with hearings for the challenge process would disappear, if that method were to be put into practice.That advocacy, and the plaintiffs’ lawsuit, came on the heels of a bill passed by Republican lawmakers in Georgia earlier this year, which would allow the removal of people from the voting rolls through challenges to voter eligibility.","Citizen lawsuit against election authorities: 'Fulton County does not maintain, nor does it even attempt to maintain, accurate voter rolls'",https://peachtreetimes.com/stories/663997871-citizen-lawsuit-against-election-authorities-fulton-county-does-not-maintain-nor-does-it-even-attempt-to-maintain-accurate-voter-rolls,7.3979077,-3.833489
georgia-peachtreetimes-665013998,Peach Tree Times,2024-10-09,Metric Media Network,Peach Tree Times,Georgia,"Governor Brian P. Kemp convened a roundtable discussion in Atlanta, Georgia, focusing on civil litigation and its effects on the state's economy. This event marked the last of three sessions planned for this fall, taking place at Waffle House's headquarters. Representatives from 12 businesses across various industries participated.Governor Kemp emphasized the importance of fostering a business-friendly environment in Georgia. ""As the No. 1 state for business for 11 consecutive years, we have always made it a priority to foster a pro-business environment that empowers job creators to create opportunity for the hardworking people of Georgia,"" he stated. He acknowledged that current litigation conditions lead to increased consumer costs and challenges for job creation.Previous roundtables included discussions with small business leaders in August and healthcare professionals in September about the impact of rising civil lawsuits on their sectors. The Data Analysis for Tort Reform Act was passed earlier this year as part of efforts to gather information necessary for future reforms.Lieutenant Governor Burt Jones expressed his commitment to removing barriers for businesses: ""My priority continues to be removing barriers and unnecessary burdens for businesses across Georgia."" He also highlighted the need for sensible lawsuit reform legislation in the upcoming session.Speaker of the House Jon Burns echoed these sentiments, acknowledging more work is needed to maintain Georgia's top business ranking: “I want to thank Governor Kemp for hosting this series of policy roundtable discussions with stakeholders across the state.”Insurance and Safety Fire Commissioner John King spoke on how litigation affects communities and small businesses: “When I think about lawsuit abuse reform, I think about the thousands of Georgia families who will be stuck in food deserts...”Waffle House CEO Joe Rogers III appreciated the collaborative effort towards reform: “On behalf of Waffle House, I’d like to thank Governor Kemp, Lt. Governor Jones, Speaker Burns, Commissioner King and members of the General Assembly...""Participants discussed how civil litigation impacts insurance rates and overall costs affecting both businesses and consumers amid record inflation. Governor Kemp remains committed to addressing these issues as legislative sessions approach.",Georgia leaders discuss civil litigation impact at final roundtable,https://peachtreetimes.com/stories/665013998-georgia-leaders-discuss-civil-litigation-impact-at-final-roundtable,2.7761073,6.092288
georgia-peachtreetimes-664578542,Peach Tree Times,2024-08-04,Metric Media Network,Peach Tree Times,Georgia,"In July, one Devices company received an FDA inspection in Georgia, according to the U.S. Food and Drug Administration (FDA). This was the lowest number of inspections per type of company made by the FDA in Georgia, equalling 5.6% of all inspections in July. The FDA routinely inspects facilities across the nation to determine if the workplaces and their products are compliant with FDA-regulated laws and regulations implemented to improve overall public health. Inspection results are then disclosed publicly for businesses to consistently make smarter business decisions for the future.The FDA is a government agency primarily responsible for monitoring the manufacturing and distribution of human and animal drugs, biological products, medical supplies and tobacco products for safety quality, according to its website.FDA Inspections in Georgia During JulyProject AreaNo Action IndicatedVoluntary Action IndicatedOfficial Action IndicatedBioresearch Monitoring2----Blood and Blood Products11--Food Composition, Standards, Labeling and Econ--1--Foodborne Biological Hazards71--Human Cellular, Tissue, and Gene Therapies4----Monitoring of Marketed Animal Drugs, Feed, and Devices2----",Georgia: Devices companies were the least FDA inspected companies in Georgia in July,https://peachtreetimes.com/stories/664578542-georgia-devices-companies-were-the-least-fda-inspected-companies-in-georgia-in-july,4.549634,14.567476
georgia-peachtreetimes-661192221,Peach Tree Times,2024-07-04,Metric Media Network,Peach Tree Times,Georgia,"In the first quarter of 2024, one Drugs company received an FDA inspection in Georgia, according to the U.S. Food and Drug Administration (FDA). This was the lowest number of inspections per type of company made by the FDA in Georgia, equalling 2.8% of all inspections in the first quarter of 2024. The FDA routinely inspects facilities across the nation to determine if the workplaces and their products are compliant with FDA-regulated laws and regulations implemented to improve overall public health. Inspection results are then disclosed publicly for businesses to consistently make smarter business decisions for the future.The FDA is a government agency primarily responsible for monitoring the manufacturing and distribution of human and animal drugs, biological products, medical supplies and tobacco products for safety quality, according to its website.FDA Inspections in Georgia During Q1Project AreaNo Action IndicatedVoluntary Action IndicatedOfficial Action IndicatedBioresearch Monitoring1----Blood and Blood Products31--Compliance: Devices2----Drug Quality Assurance--1--Food Composition, Standards, Labeling and Econ3----Foodborne Biological Hazards204--Human Cellular, Tissue, and Gene Therapies2----Technical Assistance: Food and Cosmetics--1--Tobacco Post-Market Activities2----",Georgia: Drugs companies were the least FDA inspected companies in Georgia in Q1,https://peachtreetimes.com/stories/661192221-georgia-drugs-companies-were-the-least-fda-inspected-companies-in-georgia-in-q1,4.6943164,13.304495
georgia-peachtreetimes-664063037,Peach Tree Times,2024-09-04,Metric Media Network,Peach Tree Times,Georgia,"ATLANTA (September 4, 2024) — Chairman of the Senate Study Committee on Safe Firearm Storage, Sen. Emanuel Jones (D–Decatur), issued a statement today regarding the shooting at Apalachee High School in Barrow County.""My deepest condolences are with the students, faculty, families and anyone else affected by this horrible act of violence that took place today at Apalachee High School. This tragic shooting is a stark and painful reminder that now is the time to address the critical issue of safe firearm storage.""Jones emphasized his commitment to finding solutions to prevent such tragedies. ""As Chairman of the Senate Study Committee on Safe Firearm Storage, I am committed to finding solutions to stop these tragedies before they occur. This is not about infringing on Second Amendment rights but protecting our children and their safety. The technology exists today to secure firearms effectively, ensuring that they do not fall into the hands of those who should not have access to them, particularly children.""He highlighted the significant impact of gun violence in Georgia. ""On average, 1,927 people die by guns in Georgia each year—these are not just numbers; they are lives lost and families shattered. We must do more.""Jones called for action from elected officials. ""I call on all elected officials to take meaningful action and ensure that tragedies like this never happen again. Our children deserve better. They deserve to be safe in their schools and communities, and it is our responsibility as leaders to make that a reality.""Sen. Emanuel Jones represents the 10th Senate District, which includes portions of DeKalb and Henry County. He may be reached at 404-656-0502 or via email at emanuel.jones@senate.ga.gov.For all media inquiries, please reach out to SenatePressInquiries@senate.ga.gov.",Senator Jones issues statement on Apalachee High School shooting,https://peachtreetimes.com/stories/664063037-senator-jones-issues-statement-on-apalachee-high-school-shooting,2.038419,-6.046902
georgia-peachtreetimes-664431134,Peach Tree Times,2024-09-20,Metric Media Network,Peach Tree Times,Georgia,"ATLANTA (September 20, 2024) — On Tuesday, September 24, at 9:00 a.m., the Senate Rules Subcommittee on Homeowners Associations, chaired by Sen. Matt Brass (R–Newnan), will hold its first hearing.MEETING DETAILS:Date: Tuesday, September 24, 2024Time: 9:00 a.m.Location: 450 State Capitol, 206 Washington St SW, Atlanta, GA, 30334Open to the Public: The event is open to the public. The committee meeting will be live-streamed on the Senate website here.ABOUT THE MEETING:Chairman Brass and fellow committee members will discuss the role of HOAs in Georgia communities by analyzing their current compliance with state law. The members will also review best and worst practices and the role of HOAs concerning Georgians’ constitutional rights. The total membership of the subcommittee includes Vice Chair Donzella James (D–Atlanta), Majority Leader Steve Gooch (R–Dahlonega), Minority Leader Gloria Butler (D–Stone Mountain) and Senators Brandon Beach (R–Alpharetta), Clint Dixon (R–Gwinnett) and Michael “Doc” Rhett (D–Marietta).MEDIA OPPORTUNITIES:We kindly request that members of the media confirm their attendance in advance by contacting Jantz Womack at SenatePressInquiries@senate.ga.gov.# # # #Sen. Matt Brass serves as Chairman of the Senate Committee on Rules. Sen. Brass represents the 28th Senate District, which includes Coweta and Heard, as well as parts of Douglas and Fulton County. He can be reached by email at matt.brass@senate.ga.gov.",Senate subcommittee to hold first hearing on homeowners associations,https://peachtreetimes.com/stories/664431134-senate-subcommittee-to-hold-first-hearing-on-homeowners-associations,-3.221911,-1.1543323
georgia-peachtreetimes-664710336,Peach Tree Times,2024-10-01,Metric Media Network,Peach Tree Times,Georgia,"In a move to support Historically Black Colleges and Universities (HBCUs), Sen. Sonya Halpern (D–Atlanta) has announced a new partnership between her office and the HBCU Brilliance Initiative. This collaboration aims to enhance funding, resources, and opportunities for HBCUs.“I’m thrilled to announce this partnership as a testament to my commitment to advancing HBCUs across the country,” said Sen. Halpern in a recent statement. “Earlier this year, I introduced Senate Bill 235, which aimed to elevate and support these historic institutions. Although the bill advanced through the Georgia House of Representatives, it stalled in the Senate. Nevertheless, I remain dedicated to its objectives and will continue advocating for transformative changes.”The HBCU Brilliance Initiative is housed within a Community Development Financial Institution called The Reinvestment Fund. The initiative will play a crucial role in this partnership by driving programmatic innovation and expanding access to essential technical assistance and capital funding. Together, Sen. Halpern’s office and the initiative aim to bridge gaps that have historically hindered HBCUs from reaching their full potential.“This partnership demonstrates what we can achieve when we come together for a common cause,” added Sen. Halpern. “By enhancing the financial support available to HBCUs, we can boost local economies and address systemic disparities.”As the partnership progresses, Sen. Halpern looks forward to collaborating with stakeholders to build a brighter future for HBCUs.“We’re so excited to embark on this journey with Sen. Halpern’s Office,” stated Christina Alexis, HBCU Brilliance Initiative Program Director. “Together, we WILL sustain our historic and beloved HBCUs.”Sen. Sonya Halpern serves as Vice Chair of the Senate Democratic Caucus representing neighborhoods across Atlanta, College Park, City of South Fulton, East Point, and Union City in Fulton County.For media inquiries: SenatePressInquiries@senate.ga.gov",Senator announces new partnership supporting historically black colleges,https://peachtreetimes.com/stories/664710336-senator-announces-new-partnership-supporting-historically-black-colleges,-7.8451595,-3.176802
georgia-peachtreetimes-665402301,Peach Tree Times,2024-10-22,Metric Media Network,Peach Tree Times,Georgia,"The Senate Study Committee on Veterans’ Mental Health and Housing is set to convene for its fourth meeting on Tuesday, October 29, at 10:00 a.m. The hearing will take place at the Coverdell Legislative Office Building in Atlanta, Georgia.The committee, chaired by Sen. Chuck Payne (R–Dalton), was established to assess the effectiveness of public and private programs in Georgia that provide resources to veterans. It aims to propose additional measures to ensure that veterans and their families receive adequate support after military service.This event is open to the public and will be live-streamed on the Senate website. Members of the media are encouraged to confirm their attendance by contacting Jantz Womack at SenatePressInquiries@senate.ga.gov.Sen. Chuck Payne also chairs the Senate Committee on Veterans, Military and Homeland Security and represents Georgia's 54th Senate District, which includes Whitfield and Murray County as well as part of Gordon County. He can be reached at 404.463.5402 or via email at chuck.payne@senate.ga.gov.",Senate committee on veterans' mental health to hold fourth meeting,https://peachtreetimes.com/stories/665402301-senate-committee-on-veterans-mental-health-to-hold-fourth-meeting,-5.433501,1.0772719
georgia-peachtreetimes-662825086,Peach Tree Times,2024-08-15,Metric Media Network,Peach Tree Times,Georgia,"State Representative Lydia Glaize (D-Fairburn) today celebrated a new study conducted by ConsumerAffairs, which found that Georgia has the best bridge quality in the United States for 2024.“I am ecstatic to hear of the news that Georgia ranked number one in having the best bridge quality of the U.S. in 2024,” said Rep. Glaize. “I am especially happy for the constituents of House District 67, who have seen first-hand the improvements that have been made to Line Creek Bridge, which was rebuilt in 2016. As we continue to revamp our bridges across Coweta and Fulton counties, we celebrate the much-needed advancements to our state infrastructure and the direct impact they have on folks back home. This report is a true testament of the priority we have placed on improving and caring for our transportation system and infrastructure.”ConsumerAffairs reported that Georgia achieved this ranking due to improved bridge conditions since 2009. Since that year, Georgia has increased its share of bridges in “good” condition from 51 percent to 75 percent, according to the report.To read more about Georgia’s ranking as the number one state for bridge quality in 2024, please click here.",Georgia ranked top state for bridge quality by ConsumerAffairs,https://peachtreetimes.com/stories/662825086-georgia-ranked-top-state-for-bridge-quality-by-consumeraffairs,-0.12629001,7.5510345
georgia-peachtreetimes-664310115,Peach Tree Times,2024-09-12,Metric Media Network,Peach Tree Times,Georgia,"Governor Kemp Hosts Roundtable on Healthcare Civil Litigation IssuesSeptember 12, 2024MACON, GA - Joined by other state leaders, Governor Brian P. Kemp hosted representatives from Georgia's healthcare industry for a roundtable discussion on civil litigation policies impacting the state's healthcare providers and affordability for Georgians. The event at Atrium Health's Macon campus was part of a series of listening sessions announced earlier this month.Participants included representatives from the Georgia Hospital Association, Georgia Medical Association, Georgia Health Care Association, and private practitioners.“Improving healthcare access and affordability has been one of my top priorities since day one of my administration,” said Governor Brian Kemp. “As part of our comprehensive approach to that issue, we are committed to hearing from healthcare practitioners on how the civil litigation climate in our state is impacting their ability to best care for Georgians. I'm grateful for their engagement on this topic as we look into how best to approach reform.”The first roundtable in August focused on small business leaders and the impacts of civil lawsuits on their operations. The initial step towards litigation reform began with the passage of the Data Analysis for Tort Reform Act during the 2024 legislative session, sponsored by Rep. Will Wade. This act created a mechanism to gather necessary information to guide further steps. Both chambers of the General Assembly also worked on legislation related to civil litigation, including SB 426 and SB 83.“I really appreciate the work from Governor Kemp, Lt. Governor Jones, Speaker Burns, and all members of the General Assembly for helping us move the ball forward last session,” said Insurance and Safety Fire Commissioner John King. “Lawsuit abuse reform is needed to ensure Georgia and its citizens stay in the forefront of states to do business.”Governor Kemp discussed challenges posed by current liability laws on the healthcare industry and patients in Georgia.“Georgia’s current healthcare liability laws are pulling vital resources away from our core mission – caring for patients and supporting our communities,” said Caylee Noggle, President and CEO of the Georgia Hospital Association. “While we firmly believe in holding providers accountable for patient care, many of these laws restrict access to care and threaten the survival of healthcare facilities across the state.""“On behalf of the Medical Association of Georgia, I want to thank Governor Brian Kemp for his focus on civil justice reform,” said Dr. Brett Cannon of the Medical Association of Georgia. “Georgia has a number of healthcare challenges exacerbated by the current legal climate.""“I am grateful to Governor Kemp for bringing together our state's top legislative leaders and representatives from across the healthcare continuum,” said Chris Downing, President and CEO of the Georgia Health Care Association.Participants discussed impacts on insurance rates and availability within the healthcare industry. Easing economic burdens while enhancing access to quality healthcare remains a priority.Hosted by Atrium Health, today's roundtable was an opportunity for continued engagement on this critical issue.",Gov. Kemp hosts roundtable addressing civil litigation impacts on Georgia's healthcare sector,https://peachtreetimes.com/stories/664310115-gov-kemp-hosts-roundtable-addressing-civil-litigation-impacts-on-georgia-s-healthcare-sector,2.7565455,6.1226964
georgia-peachtreetimes-664460650,Peach Tree Times,2024-09-23,Metric Media Network,Peach Tree Times,Georgia,"Last week, Sen. Jason Anavitarte (R–Dallas) was honored by the Georgia Hispanic Chamber of Commerce as one of Georgia’s 50 Most Influential Latinos. The ceremony, held at Truist Park, celebrated Latino leaders who have made significant contributions to Georgia’s social, economic, and cultural landscape.The annual recognition serves as a platform to showcase the leadership and achievements of Latino individuals across various industries. Sen. Anavitarte, who represents Senate District 31, has advocated for issues impacting the Latino community and has worked to promote economic growth and opportunity for all Georgians.In receiving the award, Sen. Anavitarte expressed his gratitude to the Chamber and emphasized the importance of continued progress for the Latino community.“I’m deeply honored to be recognized among such incredible leaders who are making a lasting impact on Georgia. The contributions of the Latino community to our state’s growth and success are undeniable, and I am committed to continuing our work to ensure that our voices are heard and that we remain a driving force in all endeavors of our state,” said Sen. Anavitarte.The event underscored the role Latinos play in shaping the cultural diversity and economic dynamism that define Georgia, with Sen. Anavitarte being a leading figure in that progress. His work in the Georgia Senate and his involvement in community initiatives have highlighted his dedication to public service and the Latino community.Sen. Jason Anavitarte serves as Chair of the Senate Majority Caucus. He represents Senate District 31, which includes Paulding and Polk Counties. He can be reached at 404-656-9221 or at Jason.anavitarte@senate.ga.gov.For media inquiries, please reach out to SenatePressInquiries@senate.ga.gov.",Senator Jason Anavitarte named among Georgia's 50 most influential Latinos,https://peachtreetimes.com/stories/664460650-senator-jason-anavitarte-named-among-georgia-s-50-most-influential-latinos,-9.37881,-4.5007443
