id,author,date,network,source,state,text,title,url,x,y
georgia-peachtreetimes-661844979,Peach Tree Times,2024-07-15,Metric Media Network,Peach Tree Times,Georgia,"A recent report by the Georgia Public Policy Foundation has examined the health insurance marketplace in Georgia since Governor Brian Kemp took office. The report highlights significant improvements in the state's health insurance landscape, which was described as ""dire"" when Kemp assumed office in 2019.The analysis focuses on waivers submitted by Governor Kemp that established both Georgia’s reinsurance program and a state-based exchange called Georgia Access, currently managed by Georgia Insurance Commissioner John King. According to the report, “other governors should emulate Kemp’s success if they wish to seize power back from Washington, D.C., bring revenue to their states and use the power of the private sector.”In 2018, many Georgians faced challenges in obtaining individual health insurance due to a lack of insurers. Only four carriers operated on the individual market at that time, with 145 counties having just one insurer and 14 counties having two. This lack of competition led to higher insurance rates and lower reimbursement rates for providers.Governor Kemp's 1332 waiver, approved in November 2020 and effective from January 1, 2022, through December 31, 2026, aimed to address these issues. Under this waiver, Georgia reimburses health insurers selling individual market plans for a percentage of claims above a certain amount. This approach helped control insurer costs and resulted in lower premiums.The reinsurance program has had a notable impact on stabilizing and lowering premiums. In 2023, statewide premiums were reduced by 12.4%, while rural counties saw reductions as high as 34.3%. Additionally, increased competition among insurers further contributed to lower premiums.As of now, only one county has as few as two carriers compared to the previous situation where many had just one or two options. Sixteen percent of counties now have at least three carriers; thirty-one percent have four; and over fifty-two percent have five or more carriers operating within them. The number of carriers participating in Georgia’s individual market rose from four in 2018 to ten in 2024.Another significant accomplishment under the Kemp administration is the growth in enrollments in individual health insurance plans through Georgia Access. This state-based healthcare exchange leverages private-sector efficiencies to offer maximum choice to residents.Since its establishment, enrollment numbers have surged from approximately 375,000 individuals enrolled in plans on the individual market in 2019 to about 1.3 million by 2024—a gain of nearly one million people or about nine percent of Georgia's total population.Overall premium reductions for individual market plans during Kemp’s tenure reached twelve percent statewide and up to thirty percent in rural areas. These developments position Georgia as a model for other states seeking similar reforms.The report concludes that adopting similar strategies could help other states reclaim authority from federal oversight while enhancing their healthcare systems through private sector involvement.___",Report highlights improvements under Governor Kemp's health insurance reforms,https://peachtreetimes.com/stories/661844979-report-highlights-improvements-under-governor-kemp-s-health-insurance-reforms,2.6111026,7.067088
georgia-peachtreetimes-665160439,Peach Tree Times,2024-10-15,Metric Media Network,Peach Tree Times,Georgia,"The Joint Blue-Ribbon Committee to Investigate Licensing Issues will convene its next meeting at Georgia Southern University in Statesboro. The session is scheduled for Friday, October 18, 2024, at 10 a.m., and will take place at the Nessmith-Lane Continuing Education Center.This committee is co-chaired by State Representative Matt Hatchett from Dublin and State Senator Blake Tillery from Vidalia. Its primary focus is to examine licensing issues within the Secretary of State’s Professional Licensing Boards Division.Interested parties can watch the proceedings via a livestream available online.",Committee on licensing issues to meet at Georgia Southern University,https://peachtreetimes.com/stories/665160439-committee-on-licensing-issues-to-meet-at-georgia-southern-university,-2.7664511,3.4502006
georgia-peachtreetimes-665033872,Peach Tree Times,2024-10-10,Metric Media Network,Peach Tree Times,Georgia,"The Senate Special Committee on the Protection of Women’s Sports is scheduled to hold its second hearing on Tuesday, October 15, at 8:00 a.m. The session will take place at the State Capitol in Atlanta and is open to the public. The committee meeting will also be available for live streaming on the Senate website.The committee, chaired by Sen. Greg Dolezal (R–Cumming), was established to examine policies from athletic associations, schools, colleges, and universities aimed at safeguarding women's sports. Additional members serving on this special committee include Sen. Jason Anavitarte (R–Dallas), Sen. Clint Dixon (R–Gwinnett), Sen. Bo Hatchett (R–Cornelia), Sen. Billy Hickman (R–Statesboro), Sen. Sheikh Rahman (D–Lawrenceville), Sen. Freddie Powell Sims (D–Dawson), and Sen. Blake Tillery (R–Vidalia).Members of the media are encouraged to confirm their attendance by contacting Jantz Womack via email at senatepressinquiries@senate.ga.gov.Senator Greg Dolezal also chairs the Senate Committee on Transportation and represents Georgia's 27th Senate District in Forsyth County.",Senate committee to hold second hearing on protection of women’s sports,https://peachtreetimes.com/stories/665033872-senate-committee-to-hold-second-hearing-on-protection-of-women-s-sports,-0.81003463,-2.113024
georgia-peachtreetimes-664460475,Peach Tree Times,2024-09-23,Metric Media Network,Peach Tree Times,Georgia,"State Representative Mack Jackson (D-Sandersville) recently hosted the second 2024 meeting of the House Rural Development Council at the historic Thomson Depot in Thomson, Georgia. The event took place in House District 128, which Rep. Jackson represents. Alongside State Representative Gerald Greene (R-Cuthbert), Jackson was appointed as co-chair of the council by House Speaker Jon Burns (R-Newington) in 2023. This meeting focused on rural healthcare, addressing issues such as maternal and infant health, physician shortages, and access to care in underserved areas.“The second meeting of the House Rural Development Council in Thomson was incredibly productive,” said Rep. Jackson. “We focused on one of rural Georgia’s most pressing challenges—healthcare, particularly maternal and infant health. These discussions provided the insights needed to craft impactful legislation that will truly serve rural communities. I was proud to host such important conversations in my district and remain committed to advocating for the healthcare services our rural residents deserve.”The meeting centered on healthcare, particularly maternal and infant health, bringing together stakeholders from across the state to discuss challenges and potential solutions aimed at improving healthcare access in rural areas. Discussions highlighted the need for more healthcare providers and facilities in these regions, particularly maternity services and specialties like OB/GYN and family medicine. The Georgia Board of Healthcare Workforce discussed strategies to attract and retain physicians in rural areas, emphasizing long-term funding for Graduate Medical Education programs and improvements in credentialing and liability processes.The council also heard presentations on school-based health centers and behavioral and mental health services in schools. Behavioral support was identified as a growing need, especially considering the Mental Health Parity Act championed by late House Speaker David Ralston. Kevin Tanner, Commissioner of Georgia Department of Behavioral Health & Developmental Disabilities (DBHDD), shared updates on efforts to address mental health crises, homelessness, and developmental disabilities in rural areas. DBHDD also highlighted the success of the 988 suicide and crisis lifeline, noting higher usage rates among rural Georgians compared to urban residents.During the meeting, Rep. Jackson honored Dorothy “Dot” Meadows Knox's family and Robert Edward “Bob” Knox Jr.'s family by presenting them with two resolutions—House Resolution 1594 and House Resolution 1599—commemorating their contributions to the Thomson community.The House Rural Development Council was established in 2017 to collaborate with rural communities for economic growth and job creation. In 2023's legislative session, House Resolution 488 was unanimously adopted renewing its mandate for this term.More information about the House Rural Development Council can be found here: https://www.legis.ga.gov/other-committees/house/2024/rural-development-council-2024###",House Rural Development Council focuses on healthcare at second annual meeting,https://peachtreetimes.com/stories/664460475-house-rural-development-council-focuses-on-healthcare-at-second-annual-meeting,-4.71746,4.629709
georgia-peachtreetimes-664558755,Peach Tree Times,2024-09-26,Metric Media Network,Peach Tree Times,Georgia,"Georgia's Attorney General Chris Carr announced that action has been taken against the Biden-Harris administration's ""absurd rule"" allowing ""biological males to compete against females."" Carr made his statement in a September 9 post on X.""We've once again taken action against the Biden-Harris administration's absurd rule allowing biological males to compete against females,"" said General Chris Carr. ""Whether it's Democrats or the NCAA, we'll continue to push back against all those intent on destroying women's sports.""According to Carr, he has submitted an amicus brief backing a Tennessee-led lawsuit that opposes the Biden-Harris administration's updated Title IX rule. The rule is being challenged for undermining women’s sports and requiring that males and females use the same bathrooms, according to a press release by Carr.""This latest action will further bolster our efforts here in Georgia and across the country as we work to block this absurd rule once and for all. We’re committed to protecting female athletes, and we will never stop fighting for women’s rights to fair competition,"" said Carr according to a press release by Carr.The U.S. Department of Education released final Title IX regulations, prohibiting sex discrimination in federally funded education programs and activities. These regulations outline protections against sex-based harassment, including provisions related to sexual violence, pregnancy, sexual orientation, and gender identity. The regulations require schools to address complaints of discrimination, ensure fairness in their processes, and communicate nondiscrimination policies to students and families while maintaining certain privacy standards, according to the U.S. Department of Education.Chris Carr was appointed as Georgia's attorney general by then-Governor Nathan Deal in 2016 and was re-elected in November 2022. Since taking office, Carr has focused on addressing issues such as human trafficking, gang activity, and opioid misuse, including the establishment of the state's first Human Trafficking Prosecution Unit and Gang Prosecution Unit, according to the Office of the Attorney General.",Georgia State AG Chris Carr: 'We’ll continue to push back against all those intent on destroying women’s sports',https://peachtreetimes.com/stories/664558755-georgia-state-ag-chris-carr-we-ll-continue-to-push-back-against-all-those-intent-on-destroying-women-s-sports,8.111414,0.21831241
georgia-peachtreetimes-664431132,Peach Tree Times,2024-09-20,Metric Media Network,Peach Tree Times,Georgia,"ATLANTA (September 20, 2024) — This week, Sen. John Albers (R–Roswell) was honored by the Georgia Fraternal Order of Police (FOP) for his legislative contributions during the 2023-2024 Legislative Session of the Georgia General Assembly. During the 2024 legislative session, Sen. Albers authored and passed legislation to raise the limit for the total percentage of funds that the Peace Officers’ Annuity and Benefit Fund may invest in alternative investments.“It is an honor to be recognized by the Fraternal Order of Police,” said Sen. Albers. “As a former first responder, I have always considered standing alongside our law enforcement officers a privilege. These men and women put their lives on the line daily, serving our communities faithfully, often in the face of danger and uncertainty. I will always remain committed to doing everything I can to support them through sound policies and resources. Whether it’s ensuring they have the training and equipment they need or advocating for their well-being both on the job and after they retire, we owe them our full support.”The Georgia Fraternal Order of Police consists of 34 Local Lodges and has more than 6,200 members across the state. The organization serves as the voice of those who dedicate their lives to protecting and serving communities nationwide.Sen. John Albers serves as Chairman of the Senate Committee on Public Safety. He represents the 56th Senate District which includes portions of Cherokee, Cobb, and North Fulton counties.For all media inquiries, please reach out to SenatePressInquiries@senate.ga.gov.",Senator John Albers honored by Georgia Fraternal Order of Police,https://peachtreetimes.com/stories/664431132-senator-john-albers-honored-by-georgia-fraternal-order-of-police,-2.7725406,-7.8998656
georgia-peachtreetimes-662658631,Peach Tree Times,2024-08-13,Metric Media Network,Peach Tree Times,Georgia,"Last week, Democratic members of the House and Senate Education committees convened a hearing at the Coverdell Legislative Office Building in Atlanta to discuss the ongoing debate surrounding the Advanced Placement (AP) African American Studies course. These members released the following statement:“Our hearing offered a vital platform for a diverse range of voices, including students, parents, and advocacy groups, to present their perspectives on the initial denial and subsequent approval of the AP African American Studies course. Central to the discussion were concerns about the timing of the decision and the impact of legislative measures enacted in 2022. Notably, House bills 1084 and 1178, alongside Senate Bill 226, were raised as concerns for their influence on educational content.“House bills 1084 and 1178 and Senate Bill 226, which passed along party lines in 2022, address issues related to the teaching of ‘divisive concepts’ and establish a process for removing books and other educational resources. The connection between these legislative actions and the recent approval of the AP African American Studies course was focal points of much testimony.”The meeting included an update from the Georgia Department of Education and the College Board on the recent approval process for the African American Studies course and surrounding issues. In response to testimony and concerns raised, these committee members pledged to investigate discussed issues further and collaborate with the General Assembly to address any underlying problems. The committee members are committed to ensuring that educational policies are fair and equitable so that all students have access to a diverse curriculum.Democratic Members who participated in this meeting include Representatives Segun Adeyina (D-Grayson), Doreen Carter (D-Lithonia), Becky Evans (D-Atlanta), Lydia Glaize (D-Fairburn), Karlton Howard (D-Augusta), Miriam Paris (D-Macon), David Wilkerson (D-Powder Springs) as well as Senators Sonya Halpern (D-Atlanta), Donzella James (D-Atlanta), Elena Parent (D-Atlanta) and Horacena Tate (D-Atlanta).To watch a video archive of this meeting, please click here.Sen. Sonya Halpern serves as Democratic Caucus Vice Chair representing Fulton County's 39th Senate District which includes many neighborhoods in Atlanta, City of South Fulton, College Park, East Point, Union City. She may be reached at sonya.halpern@senate.ga.gov or by phone at 494-656-9644.Sen. Donzella James serves as Chair of Urban Affairs Committee representing portions of Douglas & Fulton counties' 35th Senate District. She can be contacted via donzella.james@senate.ga.gov or phone at 404-463-1379.Sen. Elena Parent chairs Senate Democratic Caucus representing DeKalb County's 42nd Senate District; reachable at elena.parent@senate.ga.gov or office phone: 404-656-5109.Sen. Horacena Tate represents Cobb & Fulton counties' 38th Senate District; contactable via horacena.tate@senate.ga.gov or phone: 404-463-8053.",Hearing held by education committees discusses AP African American studies course,https://peachtreetimes.com/stories/662658631-hearing-held-by-education-committees-discusses-ap-african-american-studies-course,3.0230913,-2.2725031
georgia-peachtreetimes-662266653,Peach Tree Times,2024-07-31,Metric Media Network,Peach Tree Times,Georgia,"The Joint House Motor Vehicles and Senate Transportation Committees, chaired by State Representative John Corbett (R-Lake Park) and State Senator Greg Dolezal (R-Cumming), will convene on Wednesday, August 14, 2024, at 9 a.m. in room 406 of the Coverdell Legislative Office Building in Atlanta.Members of both committees will meet to discuss Temporary Operating Permits (TOPs), dealer tags, and broker licenses.To watch the livestream of this meeting, please click here.WHO: Members of the House Motor Vehicles and Senate Transportation CommitteesWHAT: Joint House Motor Vehicles and Senate Transportation Committee MeetingWHEN: Wednesday, August 14, 20249 a.m.WHERE: Coverdell Legislative Office BuildingRoom 40618 Capitol Square S.W.Atlanta, GA 30334",Joint House Motor Vehicles and Senate Transportation Committees to meet on August 14,https://peachtreetimes.com/stories/662266653-joint-house-motor-vehicles-and-senate-transportation-committees-to-meet-on-august-14,-1.9855349,2.968836
georgia-peachtreetimes-663916412,Peach Tree Times,2024-09-03,Metric Media Network,Peach Tree Times,Georgia,"The VA issued 933 Interest Rate Reduction Refinance Loans in Georgia during the second quarter of fiscal year 2024, compared to 71 loans the previous quarter, according to figures provided by the Veterans Affairs Home Loans Index.Loans issued in the second quarter of fiscal year 2024 equaled $315.8 million. This is an increase from the $22.9 million issued the previous quarter.The VA assists service members, veterans, and eligible surviving spouses in achieving homeownership through loans provided by banks and mortgage companies.A portion of the loan is guaranteed by the VA, which allows the lender to provide better rates.Several VA housing programs can help members buy, build or repair their homes. Loan types may include purchase loans, Interest Rate Reduction Refinance Loans (IRRRL), and Adapted Housing Grants, which are geared toward veterans with a service-connected disability.The VA's fiscal year runs from Oct. 1 to Sept. 30.",VA issues more Interest Rate Reduction Refinance Loans in Georgia in Q2 vs. Q1 2024,https://peachtreetimes.com/stories/663916412-va-issues-more-interest-rate-reduction-refinance-loans-in-georgia-in-q2-vs-q1-2024,8.921481,11.440505
georgia-peachtreetimes-664272504,Peach Tree Times,2024-09-13,Metric Media Network,Peach Tree Times,Georgia,"The House Study Committee on Safety & Consumer Protection in the Tree Care Industry, chaired by State Representative Victor Anderson (R-Cornelia), will hold its first meeting on Saturday, September 21, 2024, at 2:30 p.m. at Legacy Park-Hawkins Hall in Decatur, Georgia.The committee includes State Representatives Marvin Lim (D-Norcross), David Huddleston (R-Roopville), Jordan Ridley (R-Woodstock), and Bill Yearta (R-Sylvester).To watch a live stream of this meeting, please click here.WHO: Members of the House Study Committee on Safety & Consumer Protection in the Tree Care IndustryWHAT: Study Committee MeetingWHEN: Saturday, September 21, 20242:30 p.m.WHERE: Legacy Park-Hawkins Hall500 S. Columbia DriveDecatur, GA 30030",House study committee to meet on tree care industry safety and consumer protection,https://peachtreetimes.com/stories/664272504-house-study-committee-to-meet-on-tree-care-industry-safety-and-consumer-protection,-0.9363023,1.5537128
georgia-peachtreetimes-662095530,Peach Tree Times,2024-07-24,Metric Media Network,Peach Tree Times,Georgia,"ATLANTA – State Representative Carl Gilliard (D-Savannah), chair of the Georgia Legislative Black Caucus (GLBC), issued a statement today in response to the recent decision to remove the AP African American Studies course from state curriculum.“The GLBC stands in staunch opposition to the decision to eliminate the Advanced Placement African American Studies course from the curriculum in Georgia schools. This move, driven by changes from the State Superintendent’s Office, is viewed by the GLBC as a detrimental step backwards in fostering diversity, equity and inclusion in education,"" said Gilliard.Local districts, including Gwinnett County Public Schools, received state approval to pilot the course during the 2023-2024 school year, allowing participating students to earn credit. However, a recent requirement for a formal course request for districts interested in offering AP African American Studies has effectively halted its continuation. This requirement was communicated by Dr. Aldridge, Deputy Superintendent, on July 10, 2024.“This decision is a significant step backwards in providing students with a holistic and diverse education,"" continued Gilliard. ""African American Studies play a pivotal role in fostering understanding, empathy and appreciation of our shared history and cultural heritage. Removing this course deprives our students of a vital opportunity to learn and engage with important aspects of our society.""The GLBC calls for reconsideration of this decision and urges educational authorities to prioritize the inclusion and continuity of African American Studies in the curriculum.The Georgia Legislative Black Caucus is a non-profit, nonpartisan organization comprised of nearly 74 Georgia House and Senate members. The GLBC seeks to protect the general welfare of Black people, other people of color, and disadvantaged citizens of Georgia in matters including health and welfare, education, social and criminal justice, employment, and economic empowerment.For more information about the Georgia Legislative Black Caucus, please visit www.gablackcaucus.org",Georgia Legislative Black Caucus opposes removal of AP African American Studies,https://peachtreetimes.com/stories/662095530-georgia-legislative-black-caucus-opposes-removal-of-ap-african-american-studies,3.8039713,-1.4352336
georgia-peachtreetimes-664738809,Peach Tree Times,2024-10-03,Metric Media Network,Peach Tree Times,Georgia,"State Representative Mesha Mainor, along with local officials and members of Atlanta's business community, will hold a ceremony on October 5, 2024. The event is to honor Maceo A. Brown, founder and former president and CEO of System 5 Electronics, Inc., by unveiling the Maceo A. Brown Memorial intersection sign. This intersection is where Ralph David Abernathy Boulevard, Anderson Avenue, and Martin Luther King Jr. Drive converge.Rep. Mainor remarked on her personal connection to the community: ""Growing up in the Mozley Park community, I remember my mother attending Henry McNeal Turner High School with the Brown boys."" She emphasized the significance of recognizing extraordinary individuals from Atlanta’s Westside, saying, ""Maceo A. Brown stands out as a magnificent servant leader.""The dedication will take place at Anderson Avenue and Martin Luther King Jr. Drive NW, near System 5 Electronics' original office location at 1761 Ralph David Abernathy Boulevard. The event aims to celebrate Maceo A. Brown's contributions through his leadership and commitment to philanthropy in the community.",Memorial intersection dedicated in honor of Atlanta businessman Maceo A. Brown,https://peachtreetimes.com/stories/664738809-memorial-intersection-dedicated-in-honor-of-atlanta-businessman-maceo-a-brown,-9.849546,-1.780989
